{
  "artifacts": {
    "commitInventory": {
      "path": "commit-inventory.json",
      "sha256": "b02fc2b0c7f618b09bc8eacc744ecee31d0dd730785d7a7c6d5465903eea6073"
    },
    "partitionDecisions": {
      "path": "partition-decisions.json",
      "sha256": "01312d12a799b667a188500d4be584ac31af467d192928ec2f64d27608b8de2c",
      "state": "FINAL"
    },
    "refOperationJournal": {
      "lastRecordSha256": "1760f01245604e1ce5dab22e49a902ab16aa45c89187fe519c24516d85df6d32",
      "path": "ref-operation-journal.jsonl",
      "sha256": "6bd4988fcbe8a021a1bfe8f53b2d43aee33e8f1842268500d5ef713a2323a0f3"
    },
    "referenceCandidates": {
      "path": "reference-candidates.json",
      "sha256": "6ae712e79c52d48c0097de8b5103b1c6b1eac25fd94cfcc6c693a2dfea294b66"
    },
    "schemas": [
      {
        "path": "commit-inventory.schema.json",
        "sha256": "9d1f0d8895c796e70a970221515925c8788579938a9dedf0dccfb28b6abec6cd"
      },
      {
        "path": "freeze.schema.json",
        "sha256": "3b5da4f16bf77bc3264741d63fc1e06738793d1735af9f6861ec8af5c635926d"
      },
      {
        "path": "partition-decisions.schema.json",
        "sha256": "de920b76470530d664f44396de25bf17b1785e1d7837560b790747b48ad805b2"
      },
      {
        "path": "ref-operation-journal.schema.json",
        "sha256": "333153a636c26d1c44ba89364da13b7c00bfec34ed3ef16cc9b8843a44cd8395"
      },
      {
        "path": "reference-candidates.schema.json",
        "sha256": "e769289919d73ae202ddfbd14702aaec292c83dc795b8c0656f74ab18fd7266e"
      }
    ]
  },
  "observedAt": "2026-08-25T21:05:22.572Z",
  "schemaVersion": 1,
  "source": {
    "baseOid": "28e7dd9540622e8cb723dc000824b5eef5ae775f",
    "commitCount": 275,
    "mergeCommitCount": 0,
    "objectFormat": "sha1",
    "refs": [
      {
        "commitOid": "8a40694950d4997141fcb039b4ac45bc19a224e3",
        "name": "github:Hadden-Industries/webvowl#refs/heads/feature/ui-ux-enhancements",
        "objectOid": "8a40694950d4997141fcb039b4ac45bc19a224e3",
        "objectType": "commit",
        "observation": "EXPLICIT"
      },
      {
        "commitOid": "28e7dd9540622e8cb723dc000824b5eef5ae775f",
        "name": "github:Hadden-Industries/webvowl#refs/heads/master",
        "objectOid": "28e7dd9540622e8cb723dc000824b5eef5ae775f",
        "objectType": "commit",
        "observation": "EXPLICIT"
      },
      {
        "commitOid": "a3223d8e01019ce07dc1b49d1602bc06b9c06785",
        "name": "github:Hadden-Industries/webvowl#refs/heads/refactor/java-to-javascript",
        "objectOid": "a3223d8e01019ce07dc1b49d1602bc06b9c06785",
        "objectType": "commit",
        "observation": "EXPLICIT"
      },
      {
        "commitOid": "28e7dd9540622e8cb723dc000824b5eef5ae775f",
        "name": "github:VisualDataWeb/WebVOWL#refs/heads/master",
        "objectOid": "28e7dd9540622e8cb723dc000824b5eef5ae775f",
        "objectType": "commit",
        "observation": "EXPLICIT"
      },
      {
        "commitOid": "8a40694950d4997141fcb039b4ac45bc19a224e3",
        "name": "refs/heads/feature/ui-ux-enhancements",
        "objectOid": "8a40694950d4997141fcb039b4ac45bc19a224e3",
        "objectType": "commit",
        "observation": "LOCAL_GIT"
      },
      {
        "commitOid": "28e7dd9540622e8cb723dc000824b5eef5ae775f",
        "name": "refs/heads/master",
        "objectOid": "28e7dd9540622e8cb723dc000824b5eef5ae775f",
        "objectType": "commit",
        "observation": "LOCAL_GIT"
      },
      {
        "commitOid": "a3223d8e01019ce07dc1b49d1602bc06b9c06785",
        "name": "refs/heads/refactor/java-to-javascript",
        "objectOid": "a3223d8e01019ce07dc1b49d1602bc06b9c06785",
        "objectType": "commit",
        "observation": "LOCAL_GIT"
      },
      {
        "commitOid": "28e7dd9540622e8cb723dc000824b5eef5ae775f",
        "name": "refs/remotes/origin/HEAD",
        "objectOid": "28e7dd9540622e8cb723dc000824b5eef5ae775f",
        "objectType": "commit",
        "observation": "LOCAL_GIT"
      },
      {
        "commitOid": "8a40694950d4997141fcb039b4ac45bc19a224e3",
        "name": "refs/remotes/origin/feature/ui-ux-enhancements",
        "objectOid": "8a40694950d4997141fcb039b4ac45bc19a224e3",
        "objectType": "commit",
        "observation": "LOCAL_GIT"
      },
      {
        "commitOid": "28e7dd9540622e8cb723dc000824b5eef5ae775f",
        "name": "refs/remotes/origin/master",
        "objectOid": "28e7dd9540622e8cb723dc000824b5eef5ae775f",
        "objectType": "commit",
        "observation": "LOCAL_GIT"
      },
      {
        "commitOid": "a3223d8e01019ce07dc1b49d1602bc06b9c06785",
        "name": "refs/remotes/origin/refactor/java-to-javascript",
        "objectOid": "a3223d8e01019ce07dc1b49d1602bc06b9c06785",
        "objectType": "commit",
        "observation": "LOCAL_GIT"
      },
      {
        "commitOid": "28e7dd9540622e8cb723dc000824b5eef5ae775f",
        "name": "refs/remotes/upstream/HEAD",
        "objectOid": "28e7dd9540622e8cb723dc000824b5eef5ae775f",
        "objectType": "commit",
        "observation": "LOCAL_GIT"
      },
      {
        "commitOid": "8a7abeca398756aafec718cf6355cc55aef060cd",
        "name": "refs/remotes/upstream/build/page",
        "objectOid": "8a7abeca398756aafec718cf6355cc55aef060cd",
        "objectType": "commit",
        "observation": "LOCAL_GIT"
      },
      {
        "commitOid": "2bff60004e44f07620c84e8aa6dc2af2ad001f37",
        "name": "refs/remotes/upstream/feat/docker-local-stack",
        "objectOid": "2bff60004e44f07620c84e8aa6dc2af2ad001f37",
        "objectType": "commit",
        "observation": "LOCAL_GIT"
      },
      {
        "commitOid": "28e7dd9540622e8cb723dc000824b5eef5ae775f",
        "name": "refs/remotes/upstream/master",
        "objectOid": "28e7dd9540622e8cb723dc000824b5eef5ae775f",
        "objectType": "commit",
        "observation": "LOCAL_GIT"
      },
      {
        "commitOid": "b81bb4459a83ca559b8280d3fa29940bfc34f3a2",
        "name": "refs/remotes/upstream/refactor/vite",
        "objectOid": "b81bb4459a83ca559b8280d3fa29940bfc34f3a2",
        "objectType": "commit",
        "observation": "LOCAL_GIT"
      },
      {
        "commitOid": "600b9745af76730bf187352fc0831bd20e6d8cc4",
        "name": "refs/remotes/upstream/vowl_editor",
        "objectOid": "600b9745af76730bf187352fc0831bd20e6d8cc4",
        "objectType": "commit",
        "observation": "LOCAL_GIT"
      },
      {
        "commitOid": "5de2ced1bad995897f8f80aea3660c32fb312f22",
        "name": "refs/tags/0.5.0",
        "objectOid": "5de2ced1bad995897f8f80aea3660c32fb312f22",
        "objectType": "commit",
        "observation": "LOCAL_GIT"
      },
      {
        "commitOid": "8c4aa4bdbd3e67d263dad24931dd6551838a857f",
        "name": "refs/tags/0.5.0_RC",
        "objectOid": "8c4aa4bdbd3e67d263dad24931dd6551838a857f",
        "objectType": "commit",
        "observation": "LOCAL_GIT"
      },
      {
        "commitOid": "4f4709d177cc435909dd79732d8be3259ca83efc",
        "name": "refs/tags/0.5.1",
        "objectOid": "4f4709d177cc435909dd79732d8be3259ca83efc",
        "objectType": "commit",
        "observation": "LOCAL_GIT"
      },
      {
        "commitOid": "7be79752fc660c14398b7e42ca20b8fc13cf3622",
        "name": "refs/tags/0.5.2",
        "objectOid": "7be79752fc660c14398b7e42ca20b8fc13cf3622",
        "objectType": "commit",
        "observation": "LOCAL_GIT"
      },
      {
        "commitOid": "c7c4342dcc3575596c0be0ec240177de8fd6842b",
        "name": "refs/tags/1.0.0",
        "objectOid": "a0dec2e5d940c3bfaec2d7e8928f65dd0a277dde",
        "objectType": "tag",
        "observation": "LOCAL_GIT"
      },
      {
        "commitOid": "7e9f19a3b0d1ba5472041145cae24bd5930369e6",
        "name": "refs/tags/1.0.0-RC.0",
        "objectOid": "7e9f19a3b0d1ba5472041145cae24bd5930369e6",
        "objectType": "commit",
        "observation": "LOCAL_GIT"
      },
      {
        "commitOid": "898fdfb6bc258ce95bb74277a9c03a41c83cdad3",
        "name": "refs/tags/1.0.0-RC.1",
        "objectOid": "898fdfb6bc258ce95bb74277a9c03a41c83cdad3",
        "objectType": "commit",
        "observation": "LOCAL_GIT"
      },
      {
        "commitOid": "e78bcffb608df30e62b8cf0db1e98bd40c77bb4c",
        "name": "refs/tags/1.0.0-RC.2",
        "objectOid": "e78bcffb608df30e62b8cf0db1e98bd40c77bb4c",
        "objectType": "commit",
        "observation": "LOCAL_GIT"
      },
      {
        "commitOid": "58350978095bcba9ba41c50ab8a9c133b89dd80d",
        "name": "refs/tags/1.0.0-RC.3",
        "objectOid": "58350978095bcba9ba41c50ab8a9c133b89dd80d",
        "objectType": "commit",
        "observation": "LOCAL_GIT"
      },
      {
        "commitOid": "6ae7d467b9fed45b37254f1e952aa647f671d6bf",
        "name": "refs/tags/1.0.0-RC.4",
        "objectOid": "6ae7d467b9fed45b37254f1e952aa647f671d6bf",
        "objectType": "commit",
        "observation": "LOCAL_GIT"
      },
      {
        "commitOid": "0efda2f8c709b72e9041ab881ba94816eb355212",
        "name": "refs/tags/1.0.0-RC.5",
        "objectOid": "04ecc3189f8eb15e270c6e9cb4c6bdbc346dc1b7",
        "objectType": "tag",
        "observation": "LOCAL_GIT"
      },
      {
        "commitOid": "e64e5dbfaa33d11f79858574bce06cb8fa4e8c4f",
        "name": "refs/tags/1.0.0-RC.6",
        "objectOid": "9f4d27c96631da88612d19f3b1576f382fd2af07",
        "objectType": "tag",
        "observation": "LOCAL_GIT"
      },
      {
        "commitOid": "cabbfb6f2f2473ccf7763a7b2ea068436e2b1004",
        "name": "refs/tags/1.0.0-RC.7",
        "objectOid": "cdd67d7e7f605b3d16b8984d73e60fc45984c066",
        "objectType": "tag",
        "observation": "LOCAL_GIT"
      },
      {
        "commitOid": "975a9fb06410230872715f307f3d803029d8ffc1",
        "name": "refs/tags/1.0.4",
        "objectOid": "975a9fb06410230872715f307f3d803029d8ffc1",
        "objectType": "commit",
        "observation": "LOCAL_GIT"
      },
      {